{
  "$schema": "http://json-schema.org/draft-07/schema#",
  "title": "Opportunity",
  "type": "object",
  "required": ["strategy", "condition_id", "slug", "token_id", "outcome", "thesis", "proposed_action", "confidence", "liquidity_check"],
  "additionalProperties": true,
  "definitions": {
    "localizedText": {
      "description": "User-facing prose: a plain string, OR a bilingual object so the dashboard can toggle language.",
      "oneOf": [
        {"type": "string", "minLength": 1},
        {"type": "object", "required": ["en", "zh"],
         "properties": {"en": {"type": "string", "minLength": 1}, "zh": {"type": "string", "minLength": 1}}}
      ]
    }
  },
  "properties": {
    "strategy": {"type": "string", "enum": ["momentum", "mean-reversion", "multi-outcome-arb", "spread-capture", "risk-free-arb", "smart-money"]},
    "condition_id": {"type": "string", "minLength": 1},
    "slug": {"type": "string", "minLength": 1},
    "token_id": {"type": "string", "minLength": 1},
    "outcome": {"type": "string", "enum": ["yes", "no"]},
    "thesis": {"$ref": "#/definitions/localizedText"},
    "signal": {"type": "object"},
    "proposed_action": {
      "type": "object",
      "required": ["side", "order_type", "size_usd"],
      "properties": {
        "side": {"type": "string", "enum": ["BUY", "SELL"]},
        "order_type": {"type": "string", "enum": ["limit", "market"]},
        "price": {"type": "number", "minimum": 0, "maximum": 1},
        "size_usd": {"type": "number", "exclusiveMinimum": 0}
      },
      "allOf": [
        {
          "if": {"properties": {"order_type": {"const": "limit"}}, "required": ["order_type"]},
          "then": {"required": ["price"]}
        }
      ]
    },
    "edge_estimate": {"type": "string"},
    "confidence": {"type": "number", "minimum": 0, "maximum": 1},
    "liquidity_check": {
      "type": "object",
      "required": ["market_liquidity_usd", "depth_usd_at_price"],
      "properties": {
        "market_liquidity_usd": {"type": "number", "minimum": 0},
        "depth_usd_at_price": {"type": "number", "minimum": 0},
        "est_slippage": {"type": "number"}
      }
    },
    "risks": {"type": "array", "items": {"$ref": "#/definitions/localizedText"}}
  }
}
